読み,単語,名詞,コメント
あんこくじだいじょう,暗黒時代・上,固有名詞,メインテーマ序章
あんこくじだい・じょう,暗黒時代・上,固有名詞,メインテーマ序章
あんこくじだいげ,暗黒時代・下,固有名詞,メインテーマ第一章
あんこくじだい・げ,暗黒時代・下,固有名詞,メインテーマ第一章
そうしそうさつ,相思相殺,固有名詞,メインテーマ第二章
きしかいせい,起死回生,固有名詞,メインテーマ第三章
きゅうてんちょっか,急転直下,固有名詞,メインテーマ第四章
かいとうらんま,快刀乱麻,固有名詞,メインテーマ第五章
きょくぶえし,局部壊死,固有名詞,メインテーマ第六章
くなんようらん,苦難揺籃,固有名詞,メインテーマ第七章
どごうこうみょう,怒号光明,固有名詞,メインテーマ第八章
ぼうふうちょうぼう,暴風眺望,固有名詞,メインテーマ第九章
こうかんざんしょく,光冠残蝕,固有名詞,メインテーマ第十章
さいかえんじん,淬火煙塵,固有名詞,メインテーマ第十一章
きょうれきしょうぜん,驚靂蕭然,固有名詞,メインテーマ第十二章
きへいとはんたー,騎兵と狩人,固有名詞,サイドストーリー
あおくもゆるこころ,青く燃ゆる心,固有名詞,サイドストーリー
けんそうのおきて,喧騒の掟,固有名詞,サイドストーリー
うぉるもんどのはくぼ,ウォルモンドの薄暮,固有名詞,サイドストーリー
きかんみつりんのおさ,帰還！密林の長,固有名詞,サイドストーリー
きかん！みつりんのおさ,帰還！密林の長,固有名詞,サイドストーリー
まりあにあーる,マリア・ニアール,固有名詞,サイドストーリー
まりあ・にあーる,マリア・ニアール,固有名詞,サイドストーリー
ことうげきしん,孤島激震,固有名詞,サイドストーリー
がちゅうじん,画中人,固有名詞,サイドストーリー
おぺれーしょんおりじにうむだすと,オペレーション オリジニウムダスト,固有名詞,サイドストーリー / コラボイベント
どっそれすほりでー,ドッソレスホリデー,固有名詞,サイドストーリー
にあーらいと,ニアーライト,固有名詞,サイドストーリー
ふうせついっか,風雪一過,固有名詞,サイドストーリー
しょうしんしゅ,将進酒,固有名詞,サイドストーリー
われせんどうしゃたらん,吾れ先導者たらん,固有名詞,サイドストーリー
じんえいにまじわるざんきょう,塵影に交わる残響,固有名詞,サイドストーリー
りそうとしえんどれすかーにばる,理想都市 -エンドレスカーニバル-,固有名詞,サイドストーリー
すいぎょくのゆめ,翠玉の夢,固有名詞,サイドストーリー
しらくざーの,シラクザーノ,固有名詞,サイドストーリー
このほのおがてらすさき,この炎が照らす先,固有名詞,サイドストーリー
とうりんい,登臨意,固有名詞,サイドストーリー
やみよにいきる,闇夜に生きる,固有名詞,エピソード
いじんのみちを,遺塵の道を,固有名詞,エピソード
ちょうせきのした,潮汐の下,固有名詞,エピソード
きょうじんごう,狂人号,固有名詞,エピソード
せんちのいつわ,戦地の逸話,固有名詞,オムニバスストーリー
えんしぇんとふぉーじ,洪炉示歳,固有名詞,オムニバスストーリー
ごごのいつわ,午後の逸話,固有名詞,オムニバスストーリー
うるさすのこどもたち,ウルサスの子供たち,固有名詞,オムニバスストーリー
ありしひのかぜをもとめて,在りし日の風を求めて,固有名詞,オムニバスストーリー
かなたをのぞむ,彼方を望む,固有名詞,オムニバスストーリー
とうかじょきょく,灯火序曲,固有名詞,オムニバスストーリー
ゔぃぎろわがまなこにうつるまま,VIGILO -我が眼に映るまま-,固有名詞,オムニバスストーリー
れっどぱいん,赤松林,固有名詞,オムニバスストーリー
やみちらすひばな,闇散らす火花,固有名詞,オムニバスストーリー
みかんのだんしょう,未完の断章,固有名詞,オムニバスストーリー
ゆうけいにかげありて,夕景に影ありて,固有名詞,オムニバスストーリー
またあえたね,また会えたね,固有名詞,オムニバスストーリー / コラボイベント
しゅんぶん,春分,固有名詞,オムニバスストーリー